{
  "schemaVersion": 1,
  "id": "G-B1-03-present-perfect-vs-past",
  "level": "B1",
  "titleTr": "Present perfect mi, past simple mı? just / already / yet",
  "titleEn": "Present perfect or past simple",
  "goalTr": "Zamanı belli bitmiş olaylar için past simple, sonucu şimdi önemli olanlar için present perfect seçer; just, already ve yet'i doğru yere koyarsın.",
  "prerequisites": [
    "G-B1-01-present-perfect-experience",
    "G-B1-02-present-perfect-since-for"
  ],
  "contentVersion": 1,
  "status": "DRAFT",
  "aiGenerated": true,
  "teacherReview": null,
  "linksTo": {
    "episodes": [],
    "books": [
      "A2-K05"
    ]
  },
  "glossary": [
    "cast"
  ],
  "properNouns": [
    "Rome"
  ],
  "narration": {
    "tr": {
      "instructions": "sıcak, sakin, yavaş; genç ve güler yüzlü bir yardımcı"
    }
  }
}
