{
  "schemaVersion": 1,
  "id": "G-A1-16-have-has",
  "level": "A1",
  "titleTr": "have / has: sahiplik ve tarif",
  "titleEn": "have and has",
  "goalTr": "Sahipliği, aileyi, programı ve dış görünüşü have ve has ile söylersin; he, she ve it ile has kullanırsın.",
  "prerequisites": ["G-A1-13-third-person-s", "G-A1-15-there-is-are"],
  "contentVersion": 1,
  "status": "DRAFT",
  "aiGenerated": true,
  "teacherReview": null,
  "linksTo": { "episodes": ["A1-004", "A1-007", "A1-012"], "books": ["A1-K01", "A1-K04"] },
  "properNouns": ["Jordan", "English", "History"],
  "pronunciations": [],
  "narration": { "tr": { "instructions": "sıcak, sakin, yavaş; genç ve güler yüzlü bir yardımcı" } }
}
